Id,twitter,polarity,aspect1,aspect2,aspect3,aspect4
1,"notícias boas, que bom #quarentena #quartaligadajusticasdv. mais de 70 vacinas contra o coronavírus estão sendo desenvolvidas diz nature #coronavirus https://t.co/kdgzxogm2b",1,none,vacinas,quarentena,none
2,"#fiqueatento! ⚖️ plenário julga, nesta quarta-feira (15), por videoconferência, ações relacionadas às medidas de combate ao #coronavírus. https://t.co/t6veb1ehcc",1,medidas_de_combate,none,none,none
4,"o brasil apresenta alguns dos melhores índices de cura do coronavírus. são mais de 55% dos casos, superando países como alemanha (46,9%), espanha (39,9%), frança (27,8%) e itália (22,8%). fonte: ministério da saúde",1,índices_de_cura,ministério_da_saúde,brasil,none
5,"☝🏼 atenção! saiba quando e onde encontrar um serviço de saúde em caso suspeito de #coronavírus. sentiu febre, tosse, desconforto respiratório ou falta de ar? dirija-se para uma das quatro upas com referência no atendimento. em caso de outros sintomas, procure as demais unidades https://t.co/cxldt0saqd",1,serviço_de_saúde,caso_suspeito,upas,sintomas
11,"veja iniciativas que são #boasnotícias em meio à pandemia de #coronavírus. se liga no recadinho de emilly araújo (@emillyaraujoof), apresentadora do #topzera #covid19 #coronavírusnobrasil https://t.co/exxw7siign",1,none,none,none,none
12,#covid19: apple e google anunciam iniciativa de rastreamento de pessoas para que governos monitorem fluxos de circulação durante a pandemia do novo #coronavírus. leia em https://t.co/7ktihmjw0f 📷 marcello casal jr./@agenciabrasil/© https://t.co/zsjecqag5i,1,rastreamento_de_pessoas,fluxo_de_circulação,pandemia,none
14,#coronavirus (oms diz: não use ibuprofeno) ~ouça atualizações na região centro-oeste~https://t.co/imlsepja1t,1,oms,none,none,none
21,"55% das pessoas diagnosticadas com coronavírus já estão recuperadas, informa ministério da saúde. https://t.co/iqr6hhy3pf",1,pessoas_diagnosticadas,ministério_da_saúde,none,none
23,"@andredimauro @eliane_d_ @marcelolins68 @aurelien_gohier ... desde que começaram a usar ninguém mais precisou ser entubado, 100% de cura e 0% de óbitos.https://t.co/irkzmcd2dn",1,cura,óbitos,none,none
27,@costa_rui anuncia negociação com supermercados para viabilizar alimentação de estudantes . https://t.co/f1ddkmnpyj#covid19nasfavelas #nordesteusou #coronavirus https://t.co/b2uzgpxzve,1,alimentação_de_estudantes,none,none,none
32,@estadaointer governo da nova zelândia destina 20% dos salários para combate ao novo coronavírus -via @estadaointer https://t.co/pyz895q1wu,1,nova_zelândia,salários,combate,none
35,"olha que ótima notícia também! posta ou retweetar fabão, me ajudar a espalhar, enfim, noticias como essas trazem esperança. grande abraço. https://t.co/klz1hdxydh",1,none,none,none,none
41,"temos apenas um inimigo: o novo coronavírus. quanto ao medicamento, não preciso tomar, estou assintomático.",1,novo_coronavírus,medicamento,none,none
42,"divulga, pela primeira vez, o número de pessoas recuperadas do #coronavírus, até 14/04:▶️25.262 pacientes diagnosticados p/ #covid-19▶️1.532 óbitos▶️9.704 pacientes internados▶️14.026 recuperados",1,recuperadas,paacientes_diagnosticados,pacientes_internados,óbitos
43,"sua risada amiga, eu acho que ela é a cura pro coronavírus",1,cura,none,none,none
47,átila explicando sobre o coronavirus. https://t.co/whmayvyir3,1,none,none,none,none
48,"você sabe mto bem qual é o vídeo citado até pq o tema em questão aqui é o coronavírus. mas se vc acha interessante trazer o currículo do cara para justificar qualquer coisa, então fique a vontade.",1,none,none,none,none
54,"eu achei isso intrigante. logo na hora que uma loira, chique, bonita e rica me lacrou para a gente sair na semana o coronavírus veio bater em fortaleza foi ligeiro rapaz! essa foi por pouco loiras!",1,none,none,none,none
55,"talíria a maconha faz mal para o coronavírus viu, já avisou no twitter?",1,none,none,none,none
58,#bahiafazciência cientistas baianos propõem novas drogas para tratar o #coronavírus https://t.co/7xquotjk1l..#sectiba #ciência #tecnologia #inovação #covid19 #covid2019 https://t.co/bqw5kwgjf0,1,cientistas,drogas,none,none
60,#bomdia eu insisto e persisto. é viável fazer um pacto federal entre poderes para repassar os 2 bilhões do fundo eleitoral para saúde e auxílio às vítimas do coronavírus. mas o trabalho de convencimento dos políticos tem que ser feito pelo povo. https://t.co/anqyajn3a8,1,none,fundo_eleitoral,auxílio,none
62,#combateaocoronavírus | nossos parlamentares estão apoiando as discussões sobre o combate ao #covid19 (ou #coronavírus). o deputado @genpeternelli (sp) falou sobre as principais ações discutidas dentro do parlamento. assista! https://t.co/nqyko1tnvp,1,none,combate,none,none
63,"#coronavírus | @mineconomia propõe alternativa ao projeto de lei de apoio a estados e municípios aprovado pela câmara. entre as novas medidas e as que já estão em andamento, o valor do auxílio aos entes federativos chegaria a r$ 127,3 bilhões. saiba mais: https://t.co/k5ab4obxhm https://t.co/8xocztzqvl",1,none,auxílio_financeiro,none,none
65,#coronavirus 15 de abril 2020 #covid19 https://t.co/a6qrnx6fzt,1,none,none,none,none
66,"#coronavírus: aplicações acontecem das 19 às 22 horas e a previsão é que sejam feitas ao longo de duas semanas nas praças públicas, avenidas, serviços de saúde e comércios https://t.co/yq7bobv2hp",1,none,none,none,none
68,#coronavírus: mais um exemplo do esforço brasileiro no combate à covid-19. uma equipe de cientistas da unesp descobriu um gene humano que pode ter relação com a maior evidência de pacientes homens e idosos infectados pelo coronavírus https://t.co/e76cm1lg6l,1,combate,cientistas,pacientes,pacientes_infectados
70,"#coronavírus: plano piloto é a ra que menos respeita o isolamento. uma média de 50,4% das pessoas da área central de brasília se mantiveram em quarentena. na outra ponta, está o riacho fundo 2, com 79,1% #metrópoles https://t.co/armkcj6chi",1,brasília,quarentena,none,none
72,"#covid19| ministro do @minfraestrutura, @tarcisiogdf, indica que o @govbr trabalha para otimizar a malha aérea neste momento de crise com a #pandemia do #coronavirus, em entrevista exclusiva à tv brasil 📺 https://t.co/2ogpnrzyde",1,crise,none,none,none
74,#defensorasedefensorespúblicosnãoparam#adefensoriaestadualnãopara#defensoriasimcoronavírus: decreto de itaguaí distribui cestas básicas à alunos da rede pública . https://t.co/cgg9zjg06r https://t.co/qe8pxe4too,1,none,none,none,none
75,#defensorasedefensorespúblicosnãoparam#adefensoriaestadualnãopara#defensoriasimcoronavírus: gt de regularização fundiária da dpe-pa garante a suspensão de reintegrações de posse em belém e castanhalhttps://t.co/gu0rjpazly https://t.co/totxqu8vf8,1,none,none,none,none
76,#defensorasedefensorespúblicosnãoparam#defensoriasimcoronavírus: defensoria pública de ms faz recomendação ao município de sonora para que seja realizado o controle de acesso de pescadores à comunidade quilombola durante pandemia . https://t.co/4wjh3fxyut https://t.co/uozfdmfnob,1,controle_de_acesso,none,pandemia,none
77,"#estamospresentes | quando unimos nossas forças, podemos ir mais longe! 💪 seguimos empenhados em apoiar ações de combate ao coronavírus e temos uma novidade: iniciamos as obras para implantação rede de água em hospital de campanha [...] https://t.co/xedfle20e9",1,ações_de_combate,hospital_de_campanha,none,none
79,#plenário: dep. @cabobebeto parabeniza iniciativas do @ifal_oficial e da @ufaloficial no enfrentamento ao coronavírus.,1,enfrentamento,none,none,none
80,"#pracegover: ícones representando duas pessoas, com uma seta indicando o distanciamento entre elas. texto: distanciamento social não é férias. precisamos estar sempre atentos à higiene e sair de casa somente em extrema necessidade. o coronavírus não obedece às suas regras.",1,distanciamento_social,higiene,none,none
81,#todesacocheiode tanto ouvir a palavra coronavírus. https://t.co/82l3aqtfda,1,none,none,none,none
82,"bolsonaro abraça os eleitores, dá a mão pras pessoas, vai na padaria, vai na farmacia: 3 testes negativos pro coronavírus.• wilson witzel quarentena, lockdown, isolamento total, máscara, álcool em gel: pegou coronavírus.parece que o jogo virou, queridinho!",1,testes,isolamento,máscara,none
84,"✊🏿 mst enfrenta pandemia do coronavírus com a solidariedade | sem terra doam mais de três toneladas de frutas e verduras dos assentamentos em santa maria da boa vista, no pernambuco  . saiba mais: https://t.co/rjzwm6c71j#quarentenasemterra#alimentosaudáveléumdireito https://t.co/yfut0nkvrk",1,none,none,pernambuco,none
85,✨ mais uma iniciativa pra ajudar quem estiver passando por dificuldade... além do varal de máscaras a instituição também tá arrecadando alimentos para a montagem de cestas básicas ✨https://t.co/njqgxpw6wt,1,varal_de_máscaras,none,none,none
88,"👩🔬 concurso para área da saúde✍ inscrições pelo site, de 15/04 a 22/04: https://t.co/6ruwhfa5pc#vereadorricardoteixeira #respeito #trabalho #juntossomosmaisfortes #coronavirus #concursopublico https://t.co/kpjstlqpee",1,none,none,none,none
93,😷 o @governosp comprou 18 milhões de #máscaras de proteção da china.✅ a medida vai reforçar os estoques de equipamentos de proteção individual (epis) da #secretariadasaúdesp.▶️ o investimento totaliza r$ 63 milhões.🔗 https://t.co/xh5ezicreb#coronavírus #governosp https://t.co/rjg4a4obih,1,máscaras,china,none,sp
95,107 respiradores chegam ao maranhão para ajudar no combate ao #coronavírus. https://t.co/emjru8ky8b,1,respiradores,maranhão,combate_ao_coronavírus,none
96,32% dos casos de coronavírus no paraná já estão curados! são 199 pessoas recuperadas entre 9 e 84 anos de idade!https://t.co/41dvk8k8un,1,casos_de_coronavírus,paraná,pessoas_recuperadas,none
98,"a câmara dos deputados aprovou ontem, projeto que estabelece auxílio financeiro a estados e municípios durante 6 meses pela perda das receitas com arrecadação de impostos por causa da pandemia do coronavírus. o impacto do projeto aprovado pelos deputados é de r$ 89,6 bilhões. https://t.co/qtqkzl1vru",1,câmara_de_deputados,auxílio_financeiro,perda_das_receitas,arrecadação_de_impostos
101,a cura do coronavírus... https://t.co/qhn6ycumpf,1,cura,none,none,none
106,"a gizelly foi abraçar a fernanda e ela o coronavírus, meu deus... ai desculpa!!!!!!!!!!!!!!!!essa mulher vai matar a globo inteira. hahahahahhahaha #redebbb #bbb20 https://t.co/lebi4wg3fa",1,a_globo,none,none,none
108,"a ilha de são luís concentra hoje 94% dos casos confirmados de coronavírus no maranhão. pactuamos com a @prefeiturasl a estratégia de atendimento que consta nesse card. por favor, ajudem a difundir via whatsapp e nas redes sociais. obrigado. https://t.co/c16psqi1sx",1,casos_confirmados,maranhão,none,none
110,"a itália, um dos países mais afetados pelo coronavírus, permitiu que parte do comércio reabrisse as portas. mas a preocupação com a doença continua. #borabrasil #bandjornalismo https://t.co/vhbg4xzk4y",1,itália,none,none,none
111,"a luta contra o novo coronavírus é diária e pede ações rápidas. entregamos nesta quarta-feira (15) o hospital recife 1, construído em 20 dias. essa é a quarta unidade pronta, dos 7 hospitais de campanha que estão sendo construídos. ao todo, serão 1000 leitos. #juntospelavida https://t.co/zpx8twzu0t",1,novo_coronavírus,hospitais_de_campanha,leitos,none
113,"a national emergency library disponibilizou 1,4 milhão de e-books de maneira gratuita, mas pra isso usou o #coronavírus como desculpa, sem pedir autorização das editoras envolvidas! fundada em 1996 para arquivar páginas da web, começaram a digitalizar livros em 2005. https://t.co/srt7skcphi",1,none,none,none,none
115,"a pandemia do coronavírus é uma situação de grande dificuldade e por isso exige o comprometimento de todos nós. em coletiva, o governador @jdoriajr ressaltou a importância de obedecer às recomendações de isolamento social dada por especialistas. é hora de proteger quem amamos. https://t.co/6hg6m7fswy",1,pandemia_do_coronavírus,isolamento_social,none,none
120,"a suécia pode ser o único país do mundo que vai acertando no combate ao coronavírus. eles não fecharam nada e não proibiram nada e agora pesquisadores de harvard dizem que eles podem estar certos.em um relatório da universidade de harvard, quatro epidemiologistas e",1,suécia,none,none,none
121,"a única cidade totalmente imune ao novo coronavírus é o quinari, no acre. o apelido da cidade vem da planta quina-quina, de onde se extrai o composto milagroso que cura a covid-19. cientistas mostraram que automaticamente todos os cidadãos nascidos lá nasceram imunes à doença.",1,acre,cura_a_covid-19,cientistas,imunes_à_doenças
123,"acho que não devemos antecipar o caos, porque o caos não necessariamente vai ocorrer. todas as medidas necessárias a preservação da ordem pública e da segurança têm sido tomadas.https://t.co/zy8pm6adnc",1,preservação_da_ordem_pública,none,none,none
124,"ações, em aracaju, ajudam a evitar a proliferação do novo coronavírus no transporte coletivo https://t.co/uekm5nncjk https://t.co/zku69veptn",1,proliferação_do_novo_coronavírus,none,none,none
125,"acompanhado por honras militares e sob aplausos da equipe médica que o atendeu, o militar do #brasil, de 99 anos, saiu em uma cadeira de rodas do hospital após vencer o #coronavírus.https://t.co/p7zehwzt77",1,none,none,none,none
126,adaptamos câmeras de controle infravermelho para identificar a temperatura corporal. elas foram instaladas em pontos estratégicos de nossas áreas operacionais e administrativas. saiba: https://t.co/6bsbhygizw#juntosnossaenergiaficamaisforte #energiaparatransformar https://t.co/1hqfbzrnsd,1,câmeras_de_controle_infravermelho,none,none,none
128,agentes de fiscalização notificam comércios que não cumprem o decreto 316/2020 que autoriza a abertura parcial de comércios e serviços no horário das 10h às 16h.#pinhaispr #rmc #covidー19 #coronavirus #coronavirusbrasil #coronavirusnobrasil https://t.co/xvgy5lg8ec,1,abertura_parcial_de_comércios,none,none,none
129,agevisa proíbe em farmácias e drogarias testes rápidos para detecção do coronavírus https://t.co/v8i7wmlwjx,1,testes_rápidos,detecção_do_coronavírus,none,none
130,"ah coronavírus, meu deus kkkkkkk #redebbb #bbb20https://t.co/mdgvxspyge",1,none,none,none,none
131,ai o meu doutorzinho está com o coronavirus 💔,1,none,none,none,none
135,"alta para o nosso combatente! 🇧🇷 ernando vence mais uma batalha, agora contra o novo #coronavirus, recebendo alta no mesmo dia em que se comemora os 75 anos da “tomada de montese”, exitosa campanha das tropas brasileiras na itália, durante a 2ª guerra mundial. https://t.co/72rwyxku4z",1,itália,none,none,none
137,ao vivo no gaúcha atualidade: historiadora lilia schwarcz avalia que a pandemia de coronavírus marca o fim do século 20 e fala sobre o momento atual na história https://t.co/2gg71bzgo8#rádiogaúcha https://t.co/tmjot3gct7,1,lilia_shwarcz,pandemia,none,none
138,"aos nossos profissionais de saúde, que estão trabalhando na linha de frente no combate ao coronavírus, todo meu respeito e admiração. muito obrigado! https://t.co/bfmhl1gfri",1,profissionais_da_saúde,combate_ao_coronvirus,none,none
140,"após megaoperação, bolsonaro exonera diretor do ibama após ação contra garimpo ilegal para evitar contaminação de indígenas por coronavírus. major olivaldi borges azevedo desencadeou megaoperação para impedir a contaminação de indígenas por coronavírus https://t.co/blbdvofm7e",1,none,contaminação_de_indígenas,none,none
141,aprenda a cortar seu próprio cabelo durante o isolamento causado pelo coronavírus https://t.co/cv5ux6wn5q,1,isolamento,none,none,none
142,apresentei projeto de lei que reduz em 30% os valores das mensalidades cobradas por instituições privadas de ensino superior. a redução se justifica por conta da suspensão das aulas mudança das aulas presenciais por on-line durante o período da pandemia! https://t.co/ockicr3xkt,1,none,valores_das_mensalidades,none,ensino_superior
143,"aprovamos a lei que garante aos estados, ao distrito federal e aos municípios auxílio financeiro, equivalente a um seguro contra a queda da arrecadação do icms e iss (seguro-receita), capaz de recompor a queda das receitas por conta do #coronavírus. https://t.co/mvnzgrlg6y",1,auxilio_financeiro,queda_de_arrecadação_do_icms_e_iss,queda_das_receitas,none
145,"aquí, vendo unha serie para despexar a cabeza do coronavirus. https://t.co/wqbkapsqdi",1,none,none,none,none
146,argentina é mais eficiente contra a covid-19 do que o brasil. https://t.co/mwaihpvs87#coronavirusargentina #coronavirus #covid19 #coronavirusbrasil,1,argentina,brasil,Covid-19,none
150,assista a constantino: imensa maioria se cura do coronavírus sem sequelas no youtube https://t.co/q8b8yjpfim,1,cura,none,none,none
153,"até o momento, dos 25.262 casos confirmados de #coronavírus no #brasil, 14.026 são considerados recuperados da doença. https://t.co/yfb9e8wn4m",1,casos_confirmados,recuperados_da_doença,none,none
158,"atividade de seus habitantes, enquanto a suécia optou por manter uma linha mais aberta, com base nos conselhos de seus próprios profissionais.no entanto, o atual epidemiologista da suécia, responsável pelo combate ao coronavírus, anders tegnell, reconheceu um ponto em que os",1,suécia,combate_ao_coronvirus,anders_tegnell,none
159,atuação presente na comissão externa que debate ações preventivas ao coronavírus. https://t.co/ivsprgodxo,1,ações_preventivas,none,none,none
160,"aviões vão buscar equipamentos na china e distribuir nos estados: ‘para meus médicos trabalharem em segurança’, diz mandetta. https://t.co/ckg52blw9t https://t.co/nzy0vdhdzz",1,equipamentos_na_china,médicos,mandetta,none
163,"bem-sucedida contra coronavírus, coreia do sul é o primeiro país a votar durante pandemia",1,coreia_do_sul,none,none,none
165,"boas notícias chegam da itália 🇮🇹 e da espanha 🇪🇸, estão superando o #coronavirus https://t.co/i9yyemobhr",1,itália,espanha,none,none
166,"boas notícias: 478.503 pessoas curadas de coronavírus no mundo 14.026 curadas de coronavírus no brasil. avisem ao mandetta, ele não soube responder.muitos países europeus já estão relaxando a quarentena. comércio reabrindo.deus abençoe a todos 🙏🏼",1,pessoas_curadas,brasil,mandetta,quarentena
171,bom dia!#ficaemcasa se não o coronavirus vai te comer. https://t.co/ewa9agzupq,1,none,none,none,none
172,"brasil tem 14.026 pacientes curados da covid-19, diz ministério da saúde #msnbrasil https://t.co/g8tanpr4fy",1,pacientes_curados,Covid-19,ministério_da_saúde,none
175,buenos aires coloca máscaras em estátuas da cidade para incentivar prevenção contra covid-19,1,buenos_aires,máscaras_em_estátuas_da_cidade,prevenção_contra_covid-19,none
178,cbf discute 35 modelos para o brasileirão após pandemia do novo coronavírus https://t.co/92mcev7b3b,1,novo_coronavírus,pandemia,none,none
180,chega à itália a segunda brigada médica cubana para combater o coronavírus 🇨🇺 https://t.co/hxppsv253v,1,itália,none,combater_o_coronavírus,none
181,"temos um grupo de mais ou menos 800 médicos volutários que está atendendo de graça, por telemedicina, pacientes suspeitos ou confirmados de covid-19. O projeto se chama missão covid. Precisamos de mais médicos voluntários. RT, por favor.",1,médicos_voluntários,telemedicina,pacientes_suspeitos,missão_covid
183,china faz segunda etapa de testes contra coronavírus #falabrasil #coronavírusplantão https://t.co/vmeczqcmkq,1,china,testes,none,none
184,"Meu pai sobreviveu à Covid-19, pessoal!",1,Covid-19,none,none,none
188,coletiva de imprensa: coronavírus - medidas do governo de são paulo - 14/04/2020 https://t.co/i6gt5t5zc0,1,governo_de_são_paulo,none,none,none
189,"com 720 casos confirmados de coronavírus, rs registra dia sem mortes - https://t.co/8iee4wffaq",1,casos_confirmados,none,none,none
191,"começou! e o destaque de hoje é uma roda de conversa com a participação de pessoas que contraíram a covid-19 e que foram submetidas ao tratamento. o nosso time de especialistas também segue à disposição para tirar as suas dúvidas, aqui na @bandtv! 😉📺#aquinaband #coronavírus https://t.co/srjvvhkvt9",1,Covid-19,Covid-19,none,none
192,"A parceria do @govbr com a indústria nacional deixa o Brasil mais forte no combate ao covid-19. Após cancelamento da entrega por fornecedores internacionais, uma rede com mais de 15 instituições envolvidas darão o suporte. Detalhes: https://t.co/2SSXv1A5Lj'",1,brasil,combate_ao_covid-19,none,none
193,comissão externa debate ações preventivas ao coronavírus. https://t.co/4wvdaxui0o,1,ações_preventivas,none,none,none
194,como medidas de isolamento contra coronavírus aumentaram popularidade do presidente da argentina https://t.co/mre9rasijh https://t.co/nbnbzfcgw2,1,medidas_de_isolamento,presidente,argentina,none
195,"compartilho a matéria da gazeta do povo, que aborda o apoio da bancada do paraná no senado sobre o uso do fundo eleitoral para o enfrentamento do coronavírus. penso que devíamos acabar com esses fundos.",1,fundo_eleitoral,enfrentamento_ao_coronavírus,none,bancada_do_paraná
198,confira as medidas contra coronavírus para o cidadão https://t.co/nkdl1m74lc https://t.co/go2lvwyzlf,1,medidas_contra_coronavírus,none,none,none
215,"deputados realizam, na manhã de hoje, a primeira sessão ordinária por vídeo conferência da história da @alepa_com. a sessão é remota para manter o isolamento social e combater a disseminação do coronavírus. você poderá acompanhar pela rádio e tv alepa no https://t.co/lkcguxkj7h https://t.co/8wdubww2rt",1,vídeo_conferência,isolamento_social,combater_a_disseminação_do_coronavírus,none
217,"di ferrero e gee rocha farão live com músicas do nx zero nesta quinta-feira (16), às 21h30: https://t.co/g1ga0rxozv (📸: di ferrero/instagram) #livevaipassar https://t.co/nrl4ffwn2l",1,live_nxzero,none,none,none
218,"diante da vitória de ermando armelino pivita, de 99 anos, que ganhou uma batalha contra o #coronavírus, restou aplausos ao ex-combatente do exército durante a 2ª guerra. pivita recebeu alta nesta terça (14/4) e está curado. ele é o brasileiro mais velho a ser curado. https://t.co/b73hpyazko",1,none,none,none,none
219,"dinamarca começou a a reabrir suas escolas nesta quarta-feira (15), após um mês de fechamento em consequência da pandemia do novo coronavírus. o país, foi o primeiro europeu para reabrir as creches e escolas do ensino básico.",1,dinamarca,pandemia,novo_coronavírus,none
221,"distanciamento social intermitente pode ser necessário até 2022 se não houver vacina, diz estudo na science imunidade ao coronavírus deve ser temporária, afirmam pesquisadores da universidade harvard (via @folhaequilibrio)",1,distanciamento_social_intermitente,vacina,imunidade,none
222,"doamos r$ 1 bilhão para o combate ao coronavírus, mas somos um banco e não entendemos sobre saúde. por isso, o valor será administrado pelo todos pela saúde, uma aliança entre especialistas de diversos setores da saúde.",1,combate_ao_coronavírus,setores_da_saúde,none,none
225,"dos meus criadores de jorge amado e zélia se protegem contra o #coronavirus, no rio vermelho, em #salvador, agora é a vez de dorival caymmi, em itapuã.📸 thiago barros/reprodução_insta:salvadormeuamor https://t.co/pyx8b9rjga",1,none,none,none,none
226,"dou muito rt em bichinho e isso é muito motivo de orgulho pra mim. às vezes cê tá putaço/a e vê altas bosta de coronavírus, vulcão, live do gustavo lima, enfim, só merdaaí eu trago o conteúdo bichinhos arrombados de fofos pra sua timeline. é isso que eu faço.de nada.",1,none,none,none,none
227,"dr alexandre fernandez de almeida, cardiologista, reside em ávila na espanha, teve coronavirus e fala sobre o assunto com propriedade. ele diz que a doença não é tao letal quanto a mídia fala.vale muito à pena ouvir! https://t.co/4t1bnzds0j",1,alexandre_fernandez,none,none,none
236,"é preciso dar mais acesso ao mercado de trabalho, tanto aos jovens quanto aos mais velhos.vamos desburocratizar e flexibilizar as relações trabalhistas para promover o emprego e o crescimento econômico.@novonacamara @partidonovo30#coronavirus #covid19#santacatarina https://t.co/dpmp0zyh38",1,none,none,none,none
237,e se a gente pedir pro coronavirus dar uma pausa so pra gente ter festa junina e dps ele volta,1,none,none,none,none
238,"e se o cássio não estivesse ali? já parou pra pensar como alguém pode fazer falta na nossa vida? não relaxe as medidas preventivas contra o #coronavírus, ele mata. lave as mão. proteja os mais velhos, fique em casa e use máscara. o pior ainda não passou. #ficaemcasa https://t.co/3ftydsaapp",1,medidas_preventivas,none,none,none
239,é... hoje é dia da aplicação da resolução 672/2020 do stf... coronavírus no pretório excelso. adi 6341 e adi 6343. a discussão afeta às mps 926/20 e 927/20.,1,none,none,none,none
245,"em caso de dúvidas sobre o #coronavirus, ligue grátis para o alô vida nos números 800149, 82149, 84146 ou consulte a plataforma pensa discando *660##covid19moz https://t.co/ikv5icigwo",1,none,none,none,none
246,em direto. covid-19 em portugal: número de internados e de doentes nos cuidados intensivos diminui https://t.co/hadjohfogp via @expresso,1,Covid-19,portugal,internados,cuidados_intensivos
